22:30:33.369751 192.168.1.254.ssh > 192.168.1.10.1070: P 3337876501:3337876545(44) ack 1622793179 win 6432 (DF) [tos 0x10] 
22:30:33.369976 192.168.1.10.1070 > 192.168.1.254.ssh: . ack 44 win 64240 (DF)
22:30:36.353379 192.168.1.10.1082 > 192.168.1.254.2869: F 1662240563:1662240563(0) ack 3518332993 win 63666 (DF)
22:30:36.353597 192.168.1.254.2869 > 192.168.1.10.1082: R 3518332993:3518332993(0) win 0 (DF)
22:30:36.354595 192.168.1.10.1121 > 192.168.1.254.2869: S 1759508976:1759508976(0) win 64240 <mss 1460,nop,nop,sackOK> (DF)
22:30:36.354735 192.168.1.254.2869 > 192.168.1.10.1121: S 3904748717:3904748717(0) ack 1759508977 win 5840 <mss 1460,nop,nop,sackOK> (DF)
22:30:36.354886 192.168.1.10.1121 > 192.168.1.254.2869: . ack 1 win 64240 (DF)
22:30:36.355181 192.168.1.10.1121 > 192.168.1.254.2869: P 1:950(949) ack 1 win 64240 (DF)
22:30:36.355311 192.168.1.254.2869 > 192.168.1.10.1121: . ack 950 win 7592 (DF)
22:30:36.365816 192.168.1.254.2869 > 192.168.1.10.1121: P 1:575(574) ack 950 win 7592 (DF)
22:30:36.366150 192.168.1.254.2869 > 192.168.1.10.1121: F 575:575(0) ack 950 win 7592 (DF)
22:30:36.366301 192.168.1.10.1121 > 192.168.1.254.2869: . ack 576 win 63666 (DF)
22:30:36.366489 192.168.1.10.1121 > 192.168.1.254.2869: R 1759509926:1759509926(0) win 0 (DF)
22:30:36.370996 192.168.1.10.1122 > 192.168.1.254.2869: S 1759542330:1759542330(0) win 64240 <mss 1460,nop,nop,sackOK> (DF)
22:30:36.371180 192.168.1.254.2869 > 192.168.1.10.1122: S 3914575487:3914575487(0) ack 1759542331 win 5840 <mss 1460,nop,nop,sackOK> (DF)
22:30:36.371331 192.168.1.10.1122 > 192.168.1.254.2869: . ack 1 win 64240 (DF)
22:30:36.371504 192.168.1.10.1122 > 192.168.1.254.2869: P 1:311(310) ack 1 win 64240 (DF)
22:30:36.371615 192.168.1.254.2869 > 192.168.1.10.1122: . ack 311 win 5840 (DF)
22:30:36.371675 192.168.1.10.1122 > 192.168.1.254.2869: P 311:1433(1122) ack 1 win 64240 (DF)
22:30:36.371761 192.168.1.254.2869 > 192.168.1.10.1122: . ack 1433 win 7854 (DF)
22:30:36.371682 192.168.1.10.1122 > 192.168.1.254.2869: P 1433:1435(2) ack 1 win 64240 (DF)
22:30:36.371841 192.168.1.254.2869 > 192.168.1.10.1122: . ack 1435 win 7854 (DF)
22:30:36.391353 192.168.1.254.2869 > 192.168.1.10.1122: P 1:573(572) ack 1435 win 7854 (DF)
22:30:36.391868 192.168.1.254.2869 > 192.168.1.10.1122: F 573:573(0) ack 1435 win 7854 (DF)
22:30:36.392024 192.168.1.10.1122 > 192.168.1.254.2869: . ack 574 win 63668 (DF)
22:30:36.393717 192.168.1.10.1119 > msgr-sb46.msgr.hotmail.com.1863: P 1753364957:1753365264(307) ack 370055662 win 64151 (DF)
22:30:36.609280 msgr-sb46.msgr.hotmail.com.1863 > 192.168.1.10.1119: . ack 307 win 17133
22:30:39.310019 192.168.1.10.1119 > msgr-sb46.msgr.hotmail.com.1863: P 307:471(164) ack 1 win 64151 (DF)
22:30:39.564375 msgr-sb46.msgr.hotmail.com.1863 > 192.168.1.10.1119: . ack 471 win 17520
22:30:41.076918 192.168.1.10.1070 > 192.168.1.254.ssh: P 1:21(20) ack 44 win 64240 (DF)
